{
  "status": "not_found",
  "language": "en",
  "answer": "Not found in official sources. Please check with the relevant government office or its official website.",
  "checklist": {
    "documents": [],
    "fees": [],
    "steps": [],
    "where": ""
  },
  "citations": [],
  "confidence": "low",
  "disclaimer": "This explains official procedures only, not legal advice. Verify with the official office before submitting."
}